{"schema_version":1,"id":"02-string-operations","title":"String operations","status":"review","level":"beginner","estimated_minutes":40,"prerequisites":["01-ownership"],"concepts":["string","string-slices","utf8"],"tracks":["core"],"learning_objectives":["Manipulate UTF-8 text without assuming byte indexing."],"website":{"published":false,"order":null},"validation":{"content_rubric":"pending","examples":"passed","exercises":"pending"}}
