{"schema_version":1,"id":"01-data-types","title":"Data types","status":"review","level":"beginner","estimated_minutes":30,"prerequisites":["01-variables-mutability"],"concepts":["scalars","compound-types","type-inference"],"tracks":["core"],"learning_objectives":["Select Rust data types for common values."],"website":{"published":false,"order":null},"validation":{"content_rubric":"pending","examples":"passed","exercises":"pending"}}
