{
  "$schema": "../../schemas/topic-metadata-v1.schema.json",
  "schema_version": 1,
  "id": "01-ownership",
  "title": "Ownership",
  "status": "review",
  "level": "intermediate",
  "estimated_minutes": 120,
  "prerequisites": ["01-variables-mutability", "01-functions"],
  "concepts": ["ownership", "move-semantics", "copy-types", "drop"],
  "tracks": ["core", "java", "python", "cpp", "go"],
  "learning_objectives": [
    "State Rust's ownership rules.",
    "Predict when assignment or a function call moves a value.",
    "Distinguish Copy values from moved values.",
    "Choose when a function should take or return ownership."
  ],
  "website": {
    "published": false,
    "order": null
  },
  "validation": {
    "content_rubric": "pending",
    "examples": "passed",
    "exercises": "pending"
  }
}
