{"schema_version":1,"id":"03-testing","title":"Testing","status":"review","level":"beginner","estimated_minutes":45,"prerequisites":["01-functions"],"concepts":["unit-tests","integration-tests","assertions"],"tracks":["core"],"learning_objectives":["Write and run focused Rust tests."],"website":{"published":false,"order":null},"validation":{"content_rubric":"pending","examples":"passed","exercises":"pending"}}
