{"schema_version":1,"id":"00-hello-world","title":"Hello, world!","status":"review","level":"beginner","estimated_minutes":15,"prerequisites":[],"concepts":["rust-binary","main-function","println-macro","formatting"],"tracks":["core"],"learning_objectives":["Run a Rust binary and explain the role of its main function.","Use println! placeholders to display values."],"website":{"published":false,"order":null},"validation":{"content_rubric":"pending","examples":"passed","exercises":"pending"}}
