{"schema_version":1,"id":"06-ownership-borrowing","title":"Ownership and borrowing","status":"review","level":"intermediate","estimated_minutes":45,"prerequisites":["01-ownership"],"concepts":["ownership","borrowing","references"],"tracks":["core"],"learning_objectives":["Apply ownership and borrowing rules when designing APIs."],"website":{"published":false,"order":null},"validation":{"content_rubric":"pending","examples":"passed","exercises":"pending"}}
