{"schema_version":1,"id":"00-control-flow","title":"Control flow","status":"review","level":"beginner","estimated_minutes":35,"prerequisites":["00-data-types"],"concepts":["conditionals","loops","match","pattern-matching","if-let"],"tracks":["core"],"learning_objectives":["Use conditional expressions and loops to control a Rust program.","Write an exhaustive match expression and recognize when if let is appropriate."],"website":{"published":false,"order":null},"validation":{"content_rubric":"pending","examples":"passed","exercises":"pending"}}
