{"schema_version":1,"id":"03-documentation","title":"Documentation","status":"review","level":"beginner","estimated_minutes":25,"prerequisites":["01-functions"],"concepts":["rustdoc","api-documentation","examples"],"tracks":["core"],"learning_objectives":["Document public Rust APIs with useful examples."],"website":{"published":false,"order":null},"validation":{"content_rubric":"pending","examples":"passed","exercises":"not_applicable"}}
