{"schema_version":1,"id":"02-collections","title":"Collections","status":"review","level":"beginner","estimated_minutes":45,"prerequisites":["01-data-types"],"concepts":["vectors","hash-maps","collection-choices"],"tracks":["core"],"learning_objectives":["Choose and use standard collections for common data shapes."],"website":{"published":false,"order":null},"validation":{"content_rubric":"pending","examples":"passed","exercises":"pending"}}
