{"schema_version":1,"id":"06-lifetimes","title":"Lifetimes","status":"review","level":"intermediate","estimated_minutes":50,"prerequisites":["01-ownership"],"concepts":["lifetimes","references","borrowing"],"tracks":["core"],"learning_objectives":["Explain and annotate relationships between borrowed values."],"website":{"published":false,"order":null},"validation":{"content_rubric":"pending","examples":"passed","exercises":"pending"}}
