{"schema_version":1,"id":"00-data-types","title":"Data types","status":"review","level":"beginner","estimated_minutes":35,"prerequisites":["00-variables-mutability"],"concepts":["scalar-types","compound-types","strings","type-conversion","checked-arithmetic"],"tracks":["core"],"learning_objectives":["Select basic scalar and compound types for a small Rust program.","Distinguish an owned String from a borrowed str slice.","Use checked arithmetic when overflow must be handled explicitly."],"website":{"published":false,"order":null},"validation":{"content_rubric":"pending","examples":"passed","exercises":"pending"}}
