{"schema_version":1,"id":"06-generics","title":"Generics","status":"review","level":"intermediate","estimated_minutes":40,"prerequisites":["01-functions"],"concepts":["generics","type-parameters","trait-bounds"],"tracks":["core"],"learning_objectives":["Use generic parameters and bounds to express reusable APIs."],"website":{"published":false,"order":null},"validation":{"content_rubric":"pending","examples":"passed","exercises":"pending"}}
