{"schema_version":1,"id":"06-enums-pattern-matching","title":"Enums and pattern matching","status":"review","level":"intermediate","estimated_minutes":45,"prerequisites":["01-control-flow"],"concepts":["enums","patterns","exhaustiveness"],"tracks":["core"],"learning_objectives":["Model states with enums and handle them exhaustively."],"website":{"published":false,"order":null},"validation":{"content_rubric":"pending","examples":"passed","exercises":"pending"}}
