{
  "$schema": "../../schemas/topic-metadata-v1.schema.json",
  "schema_version": 1,
  "id": "01-variables-mutability",
  "title": "Variables and Mutability",
  "status": "review",
  "level": "beginner",
  "estimated_minutes": 90,
  "prerequisites": [],
  "concepts": ["variables", "immutability", "mutability", "shadowing", "constants"],
  "tracks": ["core", "java", "python", "cpp", "go"],
  "learning_objectives": [
    "Declare immutable and mutable variable bindings.",
    "Explain why Rust makes bindings immutable by default.",
    "Distinguish shadowing from mutation.",
    "Choose between a variable and a constant."
  ],
  "website": {
    "published": false,
    "order": null
  },
  "validation": {
    "content_rubric": "pending",
    "examples": "passed",
    "exercises": "pending"
  }
}
