{"schema_version":1,"id":"01-control-flow","title":"Control flow","status":"review","level":"beginner","estimated_minutes":35,"prerequisites":["01-variables-mutability"],"concepts":["conditionals","loops","match"],"tracks":["core"],"learning_objectives":["Choose appropriate conditional, loop, and match expressions."],"website":{"published":false,"order":null},"validation":{"content_rubric":"pending","examples":"passed","exercises":"pending"}}
