{"schema_version":1,"id":"01-functions","title":"Functions","status":"review","level":"beginner","estimated_minutes":30,"prerequisites":["01-variables-mutability"],"concepts":["parameters","return-values","expressions"],"tracks":["core"],"learning_objectives":["Write functions with clear inputs and return values."],"website":{"published":false,"order":null},"validation":{"content_rubric":"pending","examples":"passed","exercises":"pending"}}
