{"schema_version":1,"id":"02-iterator-patterns","title":"Iterator patterns","status":"review","level":"intermediate","estimated_minutes":45,"prerequisites":["02-collections"],"concepts":["iterators","map","filter"],"tracks":["core"],"learning_objectives":["Transform and collect data with iterator adaptors."],"website":{"published":false,"order":null},"validation":{"content_rubric":"pending","examples":"passed","exercises":"pending"}}
