{"schema_version":1,"id":"03-code-quality-tools","title":"Code quality tools","status":"review","level":"beginner","estimated_minutes":30,"prerequisites":["01-functions"],"concepts":["rustfmt","clippy","linting"],"tracks":["core"],"learning_objectives":["Use formatting and linting feedback in a Rust workflow."],"website":{"published":false,"order":null},"validation":{"content_rubric":"pending","examples":"passed","exercises":"not_applicable"}}
