{"schema_version":1,"id":"03-debugging","title":"Debugging","status":"review","level":"beginner","estimated_minutes":35,"prerequisites":["01-control-flow"],"concepts":["compiler-errors","debugging","diagnostics"],"tracks":["core"],"learning_objectives":["Use compiler diagnostics and focused experiments to debug Rust."],"website":{"published":false,"order":null},"validation":{"content_rubric":"pending","examples":"passed","exercises":"not_applicable"}}
