{"schema_version":1,"id":"02-common-traits","title":"Common traits","status":"review","level":"intermediate","estimated_minutes":35,"prerequisites":["01-data-types"],"concepts":["debug","clone","partial-eq"],"tracks":["core"],"learning_objectives":["Recognize common trait contracts and their derived implementations."],"website":{"published":false,"order":null},"validation":{"content_rubric":"pending","examples":"passed","exercises":"pending"}}
