{"schema_version":1,"id":"00-variables-mutability","title":"Variables and mutability","status":"review","level":"beginner","estimated_minutes":30,"prerequisites":["00-hello-world"],"concepts":["bindings","mutability","constants","shadowing","scope","type-inference"],"tracks":["core"],"learning_objectives":["Choose between an immutable binding, a mutable binding, a constant, and shadowing.","Explain how a binding's scope affects when its value is dropped."],"website":{"published":false,"order":null},"validation":{"content_rubric":"pending","examples":"passed","exercises":"pending"}}
